{
  "schema_version": 1,
  "language_id": "DL-F0-5",
  "artifact_id": "domainlease-r11-epoch2-f0-machine-grammar-v5-construction-2",
  "status": "construction_draft_not_review_target",
  "surface_digest": {
    "algorithm": "sha256",
    "projection": "DL-F0-5-language-surface-v1",
    "sha256": "02503654aae81c865cc1446fe707a49e9c50821603c41bb113dd017f79801039"
  },
  "normative_parts": [
    "f0-00-core-language-v5.md",
    "f0-01-model-transition-claims-v5.md",
    "f0-02-morphisms-proof-boundary-v5.md"
  ],
  "encoding": {
    "text": "ASCII",
    "object_unknown_fields": "reject",
    "duplicate_keys": "reject_before_schema",
    "null": "forbidden",
    "float": "forbidden",
    "integer": "nonnegative_canonical_decimal_only",
    "dynamic_name_maps": "forbidden_use_ordered_entry_arrays",
    "canonicalization": {
      "id": "DL-F0-CJSON-1",
      "applies_to": "generated_machine_instances_and_evidence",
      "object_member_order": "ascending_ASCII_key",
      "array_order": "per_collection_field_policy",
      "integer": "base10_no_sign_no_leading_zero_except_zero",
      "string": "ASCII_JSON_minimal_escape",
      "whitespace": "none",
      "trailing_newline": false
    }
  },
  "primitive_kinds": [
    "Bool",
    "Nat",
    "ModuleName",
    "LocalName",
    "QualifiedName",
    "VariableName",
    "SHA256",
    "EQ_or_NEQ",
    "AtomCarrierClass"
  ],
  "primitive_wire_types": {
    "Bool": {"form":"JSON_BOOLEAN"},
    "Nat": {"form":"JSON_INTEGER","minimum":0},
    "ModuleName": {"form":"ASCII_FULLMATCH","pattern":"[A-Za-z][A-Za-z0-9_]{0,127}"},
    "LocalName": {"form":"ASCII_FULLMATCH","pattern":"[A-Za-z][A-Za-z0-9_]{0,127}"},
    "QualifiedName": {"form":"PAIR","components":["ModuleName","LocalName"]},
    "VariableName": {"form":"ASCII_FULLMATCH","pattern":"[a-z][a-z0-9_]{0,127}"},
    "SHA256": {"form":"ASCII_FULLMATCH","pattern":"[0-9a-f]{64}"},
    "EQ_or_NEQ": {"form":"CLOSED_ENUM","values":["EQ","NEQ"]},
    "AtomCarrierClass": {"form":"CLOSED_ENUM","values":["FINITE","UNRESTRICTED"]}
  },
  "collection_kinds": {
    "suffixes": ["[]", "[1+]", "[2+]"],
    "cardinality": {
      "[]": "finite_zero_or_more",
      "[1+]": "finite_one_or_more",
      "[2+]": "finite_two_or_more"
    },
    "field_policy_required": true
  },
  "collection_field_policies": [
    {"owner_tag":"TERM_RECORD","field":"values","mode":"canonical_map","key":"field"},
    {"owner_tag":"TERM_MATCH_VARIANT","field":"branches","mode":"canonical_map","key":"variant_tag"},
    {"owner_tag":"TERM_AND","field":"operands","mode":"ordered_sequence","key":"NONE"},
    {"owner_tag":"TERM_OR","field":"operands","mode":"ordered_sequence","key":"NONE"},
    {"owner_tag":"PREMISE_AND","field":"operands","mode":"ordered_sequence","key":"NONE"},
    {"owner_tag":"PREMISE_OR","field":"operands","mode":"ordered_sequence","key":"NONE"},
    {"owner_tag":"ACTION_BRANCH","field":"updates","mode":"ordered_sequence","key":"NONE"},
    {"owner_tag":"ACTION_BRANCH","field":"emits","mode":"canonical_map","key":"event_channel"},
    {"owner_tag":"DECL_ENUM","field":"members","mode":"canonical_set","key":"SELF_CANONICAL"},
    {"owner_tag":"DECL_RECORD","field":"fields","mode":"canonical_map","key":"field"},
    {"owner_tag":"DECL_VARIANT","field":"variant_tags","mode":"canonical_map","key":"variant_tag"},
    {"owner_tag":"DECL_ACTION","field":"branches","mode":"canonical_map","key":"branch"},
    {"owner_tag":"MODULE","field":"imports","mode":"canonical_map","key":"module"},
    {"owner_tag":"MODULE","field":"declarations","mode":"canonical_set","key":"TAG_THEN_CANONICAL"},
    {"owner_tag":"MODEL","field":"modules","mode":"canonical_map","key":"name"},
    {"owner_tag":"MODEL","field":"active_modules","mode":"canonical_set","key":"SELF_CANONICAL"},
    {"owner_tag":"ATOM_CARRIER","field":"values","mode":"canonical_map","key":"value"},
    {"owner_tag":"FINITE_PROFILE","field":"atom_carriers","mode":"canonical_map","key":"atom"},
    {"owner_tag":"FINITE_PROFILE","field":"limits","mode":"canonical_map","key":"limit"},
    {"owner_tag":"FINITE_PROFILE","field":"constants","mode":"canonical_map","key":"constant"},
    {"owner_tag":"VALUE_RECORD","field":"values","mode":"canonical_map","key":"field"},
    {"owner_tag":"VALUE_FINSET","field":"values","mode":"canonical_set","key":"SELF_CANONICAL"},
    {"owner_tag":"VALUE_TOTALMAP","field":"entries","mode":"canonical_map","key":"key"},
    {"owner_tag":"STATE_VALUE","field":"cells","mode":"canonical_map","key":"location"},
    {"owner_tag":"EVENT_BUNDLE_VALUE","field":"channels","mode":"canonical_map","key":"event_channel"},
    {"owner_tag":"FINITE_RUN_VALUE","field":"transitions","mode":"ordered_sequence","key":"NONE"}
  ],
  "kind_unions": {
    "Sort": ["SORT_BOOL", "SORT_ONE", "SORT_ATOM", "SORT_ENUM", "SORT_QTY", "SORT_RECORD", "SORT_VARIANT", "SORT_OPTION", "SORT_FINSET", "SORT_TOTALMAP"],
    "TermNode": ["TERM_BOOL", "TERM_ONE", "TERM_ENUM", "TERM_QTY_ZERO", "TERM_QTY_CHECKED", "TERM_CONSTANT", "TERM_VARIABLE", "TERM_LET", "TERM_RECORD", "TERM_FIELD", "TERM_VARIANT", "TERM_MATCH_VARIANT", "TERM_NONE", "TERM_SOME", "TERM_MATCH_OPTION", "TERM_SET_EMPTY", "TERM_SET_INSERT", "TERM_SET_REMOVE", "TERM_SET_MEMBER", "TERM_SET_SUBSET", "TERM_SET_UNION", "TERM_SET_DIFFERENCE", "TERM_MAP_GET", "TERM_MAP_SET", "TERM_AND", "TERM_OR", "TERM_NOT", "TERM_IMPLIES", "TERM_IFF", "TERM_EQ", "TERM_QTY_LT", "TERM_QTY_LE", "TERM_QTY_GT", "TERM_QTY_GE", "TERM_QTY_ADD", "TERM_QTY_SUB", "TERM_IF", "TERM_FORALL", "TERM_EXISTS", "TERM_PRE_GET", "TERM_POST_GET", "TERM_EVENT_GET"],
    "Premise": ["PREMISE_CONST_EQ", "PREMISE_CONST_NEQ", "PREMISE_LIMIT_EQ", "PREMISE_LIMIT_LE", "PREMISE_LIMIT_LT", "PREMISE_LIMIT_GE_NAT", "PREMISE_ATOM_CARD_EQ", "PREMISE_ATOM_CARD_GE", "PREMISE_NOT", "PREMISE_AND", "PREMISE_OR"],
    "Declaration": ["DECL_ATOM", "DECL_ENUM", "DECL_UNIT", "DECL_LIMIT", "DECL_RECORD", "DECL_VARIANT", "DECL_CONSTANT", "DECL_CONSTANT_CONSTRAINT", "DECL_ARITH_RESULT_BINDING", "DECL_STATE_PRODUCT", "DECL_EVENT_CHANNEL", "DECL_ACTION", "DECL_PREMISE", "DECL_CLAIM_BASE_ALWAYS"],
    "Update": ["PUT_UPDATE", "PATCH_UPDATE"],
    "GroundValue": ["VALUE_BOOL", "VALUE_ONE", "VALUE_ATOM", "VALUE_ENUM", "VALUE_QTY", "VALUE_RECORD", "VALUE_VARIANT", "VALUE_NONE", "VALUE_SOME", "VALUE_FINSET", "VALUE_TOTALMAP"],
    "Scope": ["SCOPE_EXACT", "SCOPE_FINITE_CLASS", "SCOPE_ADMISSIBLE"],
    "Label": ["LABEL_STUTTER", "LABEL_DO"]
  },
  "kind_bindings": {
    "Term": "TYPED_TERM",
    "FieldTermEntry": "FIELD_TERM_ENTRY",
    "VariantTermBranch": "VARIANT_TERM_BRANCH",
    "FieldDecl": "FIELD_DECL",
    "VariantTagDecl": "VARIANT_TAG_DECL",
    "ConstantConstraint": "CONSTANT_CONSTRAINT",
    "ChannelEmit": "CHANNEL_EMIT",
    "ActionBranch": "ACTION_BRANCH",
    "Import": "IMPORT",
    "Module": "MODULE",
    "AtomValue": "ATOM_VALUE",
    "AtomCarrier": "ATOM_CARRIER",
    "LimitValue": "LIMIT_VALUE",
    "ConstantValue": "CONSTANT_VALUE",
    "GroundFieldEntry": "GROUND_FIELD_ENTRY",
    "GroundMapEntry": "GROUND_MAP_ENTRY",
    "LocationValue": "LOCATION_VALUE",
    "CellValue": "CELL_VALUE",
    "StateValue": "STATE_VALUE",
    "EventChannelValue": "EVENT_CHANNEL_VALUE",
    "EventBundleValue": "EVENT_BUNDLE_VALUE",
    "TransitionValue": "TRANSITION_VALUE"
  },
  "root_kinds": {
    "Model": "MODEL",
    "FiniteProfile": "FINITE_PROFILE",
    "FiniteRun": "FINITE_RUN_VALUE"
  },
  "sort_nodes": [
    {"tag":"SORT_BOOL","fields":[]},
    {"tag":"SORT_ONE","fields":[]},
    {"tag":"SORT_ATOM","fields":[["atom","QualifiedName"]]},
    {"tag":"SORT_ENUM","fields":[["enum","QualifiedName"]]},
    {"tag":"SORT_QTY","fields":[["unit","QualifiedName"],["limit","QualifiedName"]]},
    {"tag":"SORT_RECORD","fields":[["record","QualifiedName"]]},
    {"tag":"SORT_VARIANT","fields":[["variant","QualifiedName"]]},
    {"tag":"SORT_OPTION","fields":[["element","Sort"]]},
    {"tag":"SORT_FINSET","fields":[["element","Sort"]]},
    {"tag":"SORT_TOTALMAP","fields":[["key","Sort"],["value","Sort"]]}
  ],
  "term_nodes": [
    {"tag":"TERM_BOOL","fields":[["value","Bool"]]},
    {"tag":"TERM_ONE","fields":[]},
    {"tag":"TERM_ENUM","fields":[["enum","QualifiedName"],["member","LocalName"]]},
    {"tag":"TERM_QTY_ZERO","fields":[["unit","QualifiedName"],["limit","QualifiedName"]]},
    {"tag":"TERM_QTY_CHECKED","fields":[["unit","QualifiedName"],["limit","QualifiedName"],["value","Nat"]]},
    {"tag":"TERM_CONSTANT","fields":[["constant","QualifiedName"]]},
    {"tag":"TERM_VARIABLE","fields":[["variable","VariableName"]]},
    {"tag":"TERM_LET","fields":[["variable","VariableName"],["bound","Term"],["body","Term"]]},
    {"tag":"TERM_RECORD","fields":[["record","QualifiedName"],["values","FieldTermEntry[]"]]},
    {"tag":"TERM_FIELD","fields":[["record_term","Term"],["record","QualifiedName"],["field","LocalName"]]},
    {"tag":"TERM_VARIANT","fields":[["variant","QualifiedName"],["variant_tag","LocalName"],["payload","Term"]]},
    {"tag":"TERM_MATCH_VARIANT","fields":[["scrutinee","Term"],["variant","QualifiedName"],["branches","VariantTermBranch[]"]]},
    {"tag":"TERM_NONE","fields":[["element_sort","Sort"]]},
    {"tag":"TERM_SOME","fields":[["element_sort","Sort"],["value","Term"]]},
    {"tag":"TERM_MATCH_OPTION","fields":[["scrutinee","Term"],["element_sort","Sort"],["none_body","Term"],["some_variable","VariableName"],["some_body","Term"]]},
    {"tag":"TERM_SET_EMPTY","fields":[["element_sort","Sort"]]},
    {"tag":"TERM_SET_INSERT","fields":[["set","Term"],["element","Term"]]},
    {"tag":"TERM_SET_REMOVE","fields":[["set","Term"],["element","Term"]]},
    {"tag":"TERM_SET_MEMBER","fields":[["set","Term"],["element","Term"]]},
    {"tag":"TERM_SET_SUBSET","fields":[["left","Term"],["right","Term"]]},
    {"tag":"TERM_SET_UNION","fields":[["left","Term"],["right","Term"]]},
    {"tag":"TERM_SET_DIFFERENCE","fields":[["left","Term"],["right","Term"]]},
    {"tag":"TERM_MAP_GET","fields":[["map","Term"],["key","Term"]]},